{
  "project": {
    "width": 1920,
    "height": 1080,
    "fps": 60,
    "duration": 16,
    "background": "#05070d"
  },
  "assets": {
    "background": "assets/background.mp4",
    "music": "assets/music.wav"
  },
  "timeline": [
    {
      "id": "lyrics",
      "start": 0,
      "duration": 16,
      "layers": [
        {
          "type": "video",
          "asset": "background",
          "x": 0,
          "y": 0,
          "width": 1920,
          "height": 1080,
          "blur": 1,
          "opacity": 0.7
        },
        {
          "type": "caption",
          "x": "center",
          "y": "center",
          "fontSize": 72,
          "color": "#ffffff",
          "strokeColor": "#000000",
          "strokeWidth": 3,
          "box": true,
          "boxColor": "#00000099",
          "boxPadding": 14,
          "items": [
            {
              "text": "First lyric line",
              "start": 1,
              "duration": 3
            },
            {
              "text": "Second lyric line",
              "start": 5,
              "duration": 3
            },
            {
              "text": "Final chorus line",
              "start": 10,
              "duration": 4
            }
          ]
        }
      ]
    }
  ],
  "audio": [
    {
      "asset": "music",
      "start": 0,
      "volume": 0.8,
      "fadeIn": 0.3,
      "fadeOut": 1
    }
  ],
  "exportPreset": "youtube_1080p",
  "metadata": {
    "template": "lyric_video",
    "templateName": "Lyric Video",
    "requiredAssets": {
      "background": "video",
      "music": "audio"
    },
    "transitionStyle": "crossfade",
    "musicSlots": [
      "music"
    ],
    "sfxSlots": [],
    "placeholders": {
      "line1": "First lyric line",
      "line2": "Second lyric line"
    }
  }
}
